{
  "$schema": "https://json-schema.org/draft/2020-12/schema",
  "type": "object",
  "properties": {
    "kind": {
      "type": "string",
      "const": "historical_testimony_selection"
    },
    "schemaVersion": {
      "type": "string",
      "const": "0.1.0"
    },
    "id": {
      "type": "string",
      "pattern": "^[A-Za-z0-9][A-Za-z0-9._-]*(?![\\s\\S])"
    },
    "historyId": {
      "type": "string",
      "pattern": "^[A-Za-z0-9][A-Za-z0-9._-]*(?![\\s\\S])"
    },
    "observationId": {
      "type": "string",
      "pattern": "^[A-Za-z0-9][A-Za-z0-9._-]*(?![\\s\\S])"
    },
    "accounts": {
      "minItems": 1,
      "type": "array",
      "items": {
        "type": "object",
        "properties": {
          "sourceRef": {
            "type": "string",
            "pattern": "^source:[A-Za-z0-9][A-Za-z0-9._-]*(?![\\s\\S])"
          },
          "recording": {
            "oneOf": [
              {
                "type": "object",
                "properties": {
                  "state": {
                    "type": "string",
                    "const": "known"
                  },
                  "recordedBy": {
                    "type": "string",
                    "minLength": 1,
                    "pattern": "\\S"
                  },
                  "reference": {
                    "type": "string",
                    "minLength": 1,
                    "pattern": "\\S"
                  }
                },
                "required": [
                  "state",
                  "recordedBy",
                  "reference"
                ],
                "additionalProperties": false
              },
              {
                "type": "object",
                "properties": {
                  "state": {
                    "type": "string",
                    "const": "unknown"
                  },
                  "reason": {
                    "type": "string",
                    "minLength": 1,
                    "pattern": "\\S"
                  }
                },
                "required": [
                  "state",
                  "reason"
                ],
                "additionalProperties": false
              }
            ]
          }
        },
        "required": [
          "sourceRef",
          "recording"
        ],
        "additionalProperties": false
      }
    }
  },
  "required": [
    "kind",
    "schemaVersion",
    "id",
    "historyId",
    "observationId",
    "accounts"
  ],
  "additionalProperties": false,
  "$id": "urn:disclosureos:experimental:historical-testimony-selection:0.1.0"
}
